{
  "$schema": "https://json-schema.org/draft/2020-12/schema",
  "$id": "https://schemas.cyberwave.com/simulation.feature_profile.v1.schema.json",
  "title": "Cyberwave Simulation Feature Profile",
  "description": "The versioned set of control modes, state fields, sensor modalities, media and readiness requirements a simulation runtime must satisfy for a workload. Identified by (profile_id, version); a runtime reports the profile it implements in simulation.runtime_audit.v1.feature_profile_id. Not an options map: every requirement is a named field.",
  "type": "object",
  "additionalProperties": true,
  "required": [
    "contract",
    "profile_id",
    "version",
    "backend",
    "execution_profile",
    "control_modes",
    "state_fields",
    "sensor_modalities",
    "media",
    "limits",
    "readiness"
  ],
  "properties": {
    "contract": {
      "const": "simulation.feature_profile.v1"
    },
    "profile_id": {
      "type": "string",
      "description": "Stable identifier of this profile, e.g. 'isaac.core'. Combined with version it names an immutable requirement set."
    },
    "version": {
      "type": "integer",
      "description": "Monotonic profile version.",
      "minimum": 1
    },
    "backend": {
      "enum": [
        "mujoco",
        "mujoco_warp",
        "isaac"
      ],
      "description": "Canonical simulation backend the profile applies to."
    },
    "execution_profile": {
      "enum": [
        "isaac-cpu-physics",
        "isaac-gpu-physics",
        "isaac-newton-physics",
        null
      ],
      "description": "Isaac execution profile, or null for backends without execution profiles."
    },
    "control_modes": {
      "type": "array",
      "items": {
        "type": "string"
      },
      "description": "Mandatory Cyberwave control modes, by existing command name (e.g. joint_position, joint_velocity, gripper, locomotion_velocity, aerial_velocity, gimbal). Each mode must be mapped explicitly per asset; an unmapped mode fails preflight and is never approximated."
    },
    "state_fields": {
      "type": "array",
      "items": {
        "type": "string"
      },
      "description": "Mandatory state fields by dotted name (e.g. joint.position, joint.velocity, joint.effort, base.pose, base.twist)."
    },
    "sensor_modalities": {
      "type": "array",
      "items": {
        "enum": [
          "rgb",
          "depth",
          "imu",
          "lidar",
          "range",
          "point_cloud",
          "first_person_camera",
          "sim_viewport"
        ]
      },
      "description": "Mandatory sensor modalities; a listed modality the scene does not provide reports missing at readiness. Thermal and audio are not profile modalities: the Isaac runtime renders thermal cameras and routes microphones and speakers for whichever twins declare them, without a profile entry. New modalities are added to this enum additively."
    },
    "media": {
      "type": "object",
      "additionalProperties": true,
      "required": [
        "webrtc",
        "recording"
      ],
      "properties": {
        "webrtc": {
          "type": "boolean",
          "description": "Frames enter the existing Cyberwave WebRTC/media path."
        },
        "recording": {
          "type": "boolean",
          "description": "Existing recording selection and run association work."
        }
      }
    },
    "limits": {
      "type": "object",
      "additionalProperties": true,
      "properties": {
        "max_twins": {
          "type": "integer",
          "minimum": 0
        },
        "max_cameras": {
          "type": "integer",
          "minimum": 0
        },
        "max_camera_width": {
          "type": "integer",
          "minimum": 0
        },
        "max_camera_height": {
          "type": "integer",
          "minimum": 0
        },
        "max_camera_fps": {
          "type": "number",
          "minimum": 0
        },
        "max_lidar_rays": {
          "type": "integer",
          "minimum": 0
        },
        "physics_timestep_s": {
          "type": "number",
          "exclusiveMinimum": 0
        }
      },
      "description": "Declared operating limits. Open for additive limits."
    },
    "readiness": {
      "type": "object",
      "additionalProperties": true,
      "required": [
        "required_first_samples"
      ],
      "properties": {
        "required_first_samples": {
          "type": "array",
          "items": {
            "type": "string"
          },
          "description": "Capabilities (sensor ids, modalities or state streams) whose first valid sample is required before the runtime reports ready."
        }
      }
    }
  }
}
